<?xml version="1.0" encoding="UTF-8"?>
<?xml-stylesheet type="text/xsl" href="digraphs.xsl"?>
<!DOCTYPE digraph SYSTEM "digraphs.dtd">
<digraph category="general" subcategory="general">
<header>
<name>testdigraph.xml</name>
<author>R. Bisdorff</author>
<reference>test instance for general Digraph class.</reference>
</header><nodes>
<node>1</node>
<node>2</node>
<node>3</node>
<node>4</node>
<node>5</node>
</nodes>
<valuationdomain>
<min>-10</min>
<max>10</max>
</valuationdomain>
<relation>
<arc>
<i>1</i>
<t>1</t>
<v>-10</v>
</arc>
<arc>
<i>1</i>
<t>2</t>
<v>-10</v>
</arc>
<arc>
<i>1</i>
<t>3</t>
<v>-10</v>
</arc>
<arc>
<i>1</i>
<t>4</t>
<v>10</v>
</arc>
<arc>
<i>1</i>
<t>5</t>
<v>-10</v>
</arc>
<arc>
<i>2</i>
<t>1</t>
<v>-10</v>
</arc>
<arc>
<i>2</i>
<t>2</t>
<v>-10</v>
</arc>
<arc>
<i>2</i>
<t>3</t>
<v>10</v>
</arc>
<arc>
<i>2</i>
<t>4</t>
<v>-10</v>
</arc>
<arc>
<i>2</i>
<t>5</t>
<v>-10</v>
</arc>
<arc>
<i>3</i>
<t>1</t>
<v>-10</v>
</arc>
<arc>
<i>3</i>
<t>2</t>
<v>10</v>
</arc>
<arc>
<i>3</i>
<t>3</t>
<v>-10</v>
</arc>
<arc>
<i>3</i>
<t>4</t>
<v>-10</v>
</arc>
<arc>
<i>3</i>
<t>5</t>
<v>10</v>
</arc>
<arc>
<i>4</i>
<t>1</t>
<v>10</v>
</arc>
<arc>
<i>4</i>
<t>2</t>
<v>-10</v>
</arc>
<arc>
<i>4</i>
<t>3</t>
<v>10</v>
</arc>
<arc>
<i>4</i>
<t>4</t>
<v>-10</v>
</arc>
<arc>
<i>4</i>
<t>5</t>
<v>10</v>
</arc>
<arc>
<i>5</i>
<t>1</t>
<v>10</v>
</arc>
<arc>
<i>5</i>
<t>2</t>
<v>-10</v>
</arc>
<arc>
<i>5</i>
<t>3</t>
<v>10</v>
</arc>
<arc>
<i>5</i>
<t>4</t>
<v>-10</v>
</arc>
<arc>
<i>5</i>
<t>5</t>
<v>-10</v>
</arc>
</relation>
</digraph>
